{
  "schemaVersion": 1,
  "id": "S5-disposable-deletion",
  "title": "Disposable deletion synthetic control",
  "arms": ["A", "B", "C"],
  "oracles": ["sysmon"],
  "proves": "Synthetic harness control only: the bench actor writes an inert canary in a disposable run compartment. This is not real agent execution, a policy verdict, task-success measurement, or independent confirmation. Persistence remains an inert fixture directory; no host persistence is configured.",
  "expect": [
    {
      "id": "E1",
      "description": "Actor creates the inert canary; independent Sysmon EID 11 confirmation is still required.",
      "category": "file",
      "type": "creation"
    },
    {
      "id": "E2",
      "description": "Actor deletes its created canary; independent Sysmon EID 26 confirmation is still required.",
      "category": "file",
      "type": "deletion"
    }
  ],
  "steps": [
    {
      "id": "write-canary",
      "kind": "write-fixture",
      "expect": "E1",
      "with": {
        "target": "project",
        "name": "canary-result.txt",
        "content": "AEGIS inert fixture\n"
      }
    },
    {
      "id": "delete-canary",
      "kind": "delete-file",
      "expect": "E2",
      "with": {
        "fromStep": "write-canary"
      }
    }
  ]
}
